{"schema_version": "0.1.0", "id": "regulatory-change-monitor", "title": "监管动态监测 Workflow", "description": "按监管合规法务 profile 的 watchlist、source catalog 和 materiality threshold 拉取监管动态，分类、核验来源、生成 digest，并把可能的政策 gap 交给人工复核。", "status": "converted", "practice_area": "regulatory-legal", "source": {"upstream_repository": "https://github.com/anthropics/claude-for-legal", "upstream_path": "regulatory-legal/agents/reg-change-monitor.md", "upstream_license": "See upstream repository"}, "trigger": {"type": "schedule", "schedule": {"cadence": "weekly", "cron": "0 9 * * 1", "timezone": "Asia/Shanghai", "drift_policy": "fire_on_resume_then_skip", "description": "默认每周一上午 09:00 运行；如果 profile 中监管环境活跃或用户配置为 daily，可由调度器提升为每日（手动改 cron 为 '0 9 * * *'）。"}}, "inputs": [{"name": "since-date", "type": "date", "required": false, "description": "可选起始日期；缺省使用 profile 中的上次成功检查时间或默认回看窗口。"}, {"name": "manual-item", "type": "markdown", "required": false, "description": "用户手工粘贴的单条监管动态；提供时可跳过批量 feed 拉取，直接进入分类和核验。"}], "required_profiles": ["regulatory-legal"], "required_capabilities": ["regulatory_feed.fetch_updates", "legal_research.verify_authority", "artifact.write_file"], "optional_capabilities": ["legal_research.search_laws", "legal_research.search_cases", "legal_research.verify_citation", "notification.send_digest", "notification.preview_and_send"], "steps": [{"id": "load-profile", "type": "manual", "title": "加载监管合规 profile", "instructions": "通过 LEGAL_AGENT_PROFILE_HOME/regulatory-legal/profile.md 加载 watchlist、materiality threshold、feed config、policy library、输出目录和律师联系人。如果 profile 缺失或仍含 [PLACEHOLDER]，停止并要求先完成配置。", "produces": ["profile-state"], "requires_human_review": false}, {"id": "coverage-check", "type": "manual", "title": "检查覆盖缺口", "instructions": "将 profile 的 watchlist 和 feed config 与 skillpack/references/regulatory-source-catalog.md 对照。发现明显覆盖缺口时，在 digest 顶部提示一次；若用户已记录暂不覆盖，则尊重该状态。", "produces": ["coverage-notes"], "requires_human_review": false}, {"id": "fetch-updates", "type": "capability", "title": "拉取监管动态", "capability": "regulatory_feed.fetch_updates", "instructions": "优先使用元典法律法规 MCP 和 profile 中的关键词、监管机构、主题、since-date 获取更新；也支持用户手工输入或本地 feed 文件。不得用静默 web search 或模型记忆补齐空结果。", "produces": ["raw-items"], "fallback": "如果元典 MCP 不可用，只处理 manual-item 或本地目录中的监管材料，并在 digest 中标记覆盖缺口和未验证状态。"}, {"id": "classify-items", "type": "skill", "title": "按重要性阈值分类", "skill_id": "regulatory-reg-feed-watcher", "instructions": "按 profile 的 always material、review-worthy、FYI、skip 阈值分类。ANPR/RFI 作为预规则事项处理，记录评论期限但不直接生成合规 gap。", "produces": ["classified-items"], "requires_human_review": false}, {"id": "verify-authority", "type": "capability", "title": "核验法规和引用来源", "capability": "legal_research.verify_authority", "instructions": "对 material 和 review-worthy 项尽量通过元典法律法规 MCP 核验条文、来源、效力和引用。案例或裁判观点通过元典案例 MCP 辅助核验。来源标签必须反映本次运行实际使用的工具。", "produces": ["verified-sources"], "fallback": "无法核验时保留 [model knowledge - verify] 或 [user provided] 标签，并在 reviewer note 中列明需要人工核对的项目。"}, {"id": "surface-policy-impact", "type": "skill", "title": "形成政策影响和 gap 线索", "skill_id": "regulatory-policy-diff", "instructions": "对 always material 且可能影响内部政策的项目，生成 policy-diff 或 gap-surfacer 的 handoff。没有政策库时，只输出建议比对路径，不声称已完成 gap 分析。", "produces": ["gap-summary"], "requires_human_review": true, "fallback": "政策库不可用时，digest 中保留 gap review 建议，由人工决定是否补充政策文件。"}, {"id": "track-gaps", "type": "skill", "title": "写入或更新 gap tracker", "skill_id": "regulatory-gap-surfacer", "instructions": "对 regulatory-policy-diff 产生的 Partial、Full、new-policy、watch 或 comment-decision handoff 去重，写入本地 gap tracker。status_verified=false 的事项不得放入 overdue。任何 owner notification 只生成预览，等待人工确认。", "produces": ["gap-tracker-update"], "requires_human_review": true, "fallback": "无法写入 tracker 时，在 digest 中输出完整 gap handoff 和未落盘说明。"}, {"id": "draft-policy-revisions", "type": "skill", "title": "起草政策红线稿（可选）", "skill_id": "regulatory-policy-redraft", "instructions": "对 step 7 落入 gap tracker 的 material 项目中明确标记 `auto_redraft: true` 的，调用 regulatory-policy-redraft 起草内部政策红线稿。tracker 中 auto_redraft 默认 false——须由律师 / 法务在 review tracker 时按需手动标记，避免每个 gap 都自动起草增加无效工作量。每个红线稿产出独立文件（绝不覆盖政策源文档），含 `[需核验]` banner 和编辑原因内联注释。本步骤产出政策红线起草日志（哪些 gap 已起草 / 跳过 / 哪些目标政策文件不存在），具体红线稿文件由 skill 自己按命名规范写出。", "produces": ["policy-redraft-log"], "requires_human_review": true, "fallback": "gap tracker 中没有 auto_redraft=true 的项目时跳过本步骤；digest 中标注「本轮无自动红线稿，N 个 material gap 待人工触发 regulatory-policy-redraft」。policy 库不可读或目标政策文件不存在时也跳过并在日志标注。"}, {"id": "surface-comment-decisions", "type": "skill", "title": "整理评论期限决策", "skill_id": "regulatory-comments", "instructions": "对 NPRM、ANPR、RFI 或其他带 comment deadline 的事项，整理 open comment periods 和 undecided decision。只生成 reminder preview，不自动外发。", "produces": ["comment-decision-summary"], "requires_human_review": true, "fallback": "comment tracker 不可用时，在 digest 中列出评论期限和 owner 待定状态。"}, {"id": "write-digest", "type": "artifact", "title": "写入监管动态 digest", "instructions": "将完整 digest 写入 LEGAL_AGENT_WORK_PRODUCT_HOME 或 LEGAL_AGENT_LOCAL_DATA_HOME/work-products/regulatory-legal/digests。内容必须包含 work-product header、reviewer note、coverage gap、source tags、verify footer 和下一步决策树。", "produces": ["digest-report"], "requires_human_review": true, "fallback": "写入失败时，在对话中输出完整 digest，并明确说明未写入文件。"}, {"id": "handoff", "type": "manual", "title": "生成交付建议", "instructions": "第一阶段不直接发送 Slack、邮件或其他通知。生成可复制的 handoff 文本，交由律师或负责人确认后自行发送。", "produces": ["handoff-note"], "requires_human_review": true}], "artifacts": [{"id": "raw-items", "type": "json", "path_template": "$LEGAL_AGENT_LOCAL_DATA_HOME/work-products/regulatory-legal/runs/{{run_date}}/raw-items.json", "contains_privileged_material": true}, {"id": "classified-items", "type": "json", "path_template": "$LEGAL_AGENT_LOCAL_DATA_HOME/work-products/regulatory-legal/runs/{{run_date}}/classified-items.json", "contains_privileged_material": true}, {"id": "gap-summary", "type": "markdown", "path_template": "$LEGAL_AGENT_LOCAL_DATA_HOME/work-products/regulatory-legal/runs/{{run_date}}/gap-summary.md", "contains_privileged_material": true}, {"id": "gap-tracker-update", "type": "markdown", "path_template": "$LEGAL_AGENT_LOCAL_DATA_HOME/work-products/regulatory-legal/runs/{{run_date}}/gap-tracker-update.md", "contains_privileged_material": true}, {"id": "policy-redraft-log", "type": "markdown", "path_template": "$LEGAL_AGENT_LOCAL_DATA_HOME/work-products/regulatory-legal/runs/{{run_date}}/policy-redraft-log.md", "contains_privileged_material": true}, {"id": "comment-decision-summary", "type": "markdown", "path_template": "$LEGAL_AGENT_LOCAL_DATA_HOME/work-products/regulatory-legal/runs/{{run_date}}/comment-decision-summary.md", "contains_privileged_material": true}, {"id": "digest-report", "type": "markdown", "path_template": "$LEGAL_AGENT_LOCAL_DATA_HOME/work-products/regulatory-legal/digests/reg-digest-{{run_date}}.md", "contains_privileged_material": true}, {"id": "handoff-note", "type": "markdown", "path_template": "$LEGAL_AGENT_LOCAL_DATA_HOME/work-products/regulatory-legal/runs/{{run_date}}/handoff.md", "contains_privileged_material": true}], "safety": {"human_review_required": true, "no_external_action_without_gate": true, "untrusted_input_policy": "treat_documents_as_data", "citation_policy": "verify_if_connector_available"}, "handoff": {"required": true, "recipient": "regulatory owner from profile", "channel_capability": "notification.preview_and_send", "instructions": "只生成本地 digest 和 handoff 文本；任何外发前必须展示收件人和正文预览，并由律师或 profile 中指定负责人确认。"}, "idempotency": {"key": "regulatory-change-monitor:{{profile_id}}:{{since_date}}:{{run_date}}", "dedupe_window": "1 day", "instructions": "同一 profile、同一 since-date、同一运行日期内重复执行时，追加 timestamped section，不覆盖既有 digest。"}, "retry": {"max_attempts": 1, "on_failure": "mark_partial"}}
