{"schema_version": "0.1.0", "id": "litigation-docket-watcher", "title": "诉讼案件审判流程监测 Workflow", "description": "按 litigation-legal profile 的活跃案件组合，从中国审判流程信息公开网 / 元典案例 MCP 拉取新进展（立案 / 答辩 / 裁定 / 开庭 / 判决 / 期限指定），按《民诉法》+ 司法解释推算候选期限（线索而非日历项，律师必须核验），对照 history.md 与 chronology 时间线 surface 进展变化和 overdue deliverable，生成案件 docket 报告。", "status": "converted", "practice_area": "litigation-legal", "source": {"upstream_repository": "https://github.com/anthropics/claude-for-legal", "upstream_path": "litigation-legal/agents/docket-watcher.md", "upstream_license": "See upstream repository"}, "trigger": {"type": "schedule", "schedule": {"cadence": "weekly", "cron": "0 9 * * 1", "timezone": "Asia/Shanghai", "drift_policy": "fire_on_resume_then_skip", "description": "默认每周一上午 09:00 sweep 所有非 closed 案件；cadence 是 floor 不是 ceiling——14 天内有开庭的案件 / trial 阶段案件 / risk:critical 案件由调度器升为 daily（cron '0 9 * * *'）。立案 / 临时裁定等关键事件无论 schedule 何时都即时升级。"}}, "inputs": [{"name": "since-date", "type": "date", "required": false, "description": "可选起始日期；缺省按每案件 _log.yaml 中的 last_checked_at 或默认 7 天回看窗口。"}, {"name": "matter-filter", "type": "string", "required": false, "description": "可选 matter_id 限定单案件 docket check（如 [LIT-2025-042]），用于临时手动跑某案件而非全 portfolio。"}], "required_profiles": ["litigation-legal"], "required_capabilities": ["artifact.write_file"], "optional_capabilities": ["legal_research.search_cases", "legal_research.search_laws", "legal_research.verify_authority", "legal_research.fetch_case", "notification.preview_and_send"], "steps": [{"id": "load-profile", "type": "manual", "title": "加载诉讼业务 profile", "instructions": "通过 LEGAL_AGENT_PROFILE_HOME/litigation-legal/profile.md 加载：风险校准、house style、escalation 矩阵、常见管辖法院 list、告警通道（飞书 / 钉钉 / 企微 DM / 邮件 / 仅 inline）、工作产品标头规则（律师法 38 条）。如果 profile 缺失或仍含 [PLACEHOLDER]，停止并提示先跑 litigation-cold-start-interview。", "produces": ["profile-state"], "requires_human_review": false}, {"id": "load-portfolio", "type": "skill", "title": "加载活跃案件组合", "skill_id": "litigation-portfolio-status", "instructions": "调用 litigation-portfolio-status 拿 _log.yaml 中所有 status != closed 的案件，含 matter_id / 管辖法院 / 诉讼阶段 / 风险级别 / last_checked_at / 开放 deliverables / next_deadline。matter-filter input 指定时只取该单 matter。", "produces": ["active-portfolio"], "requires_human_review": false, "fallback": "_log.yaml 不存在或为空时停止 workflow 并提示先跑 litigation-matter-intake 录入第一个案件。"}, {"id": "classify-cadence", "type": "manual", "title": "按 cadence 分组案件", "instructions": "把活跃案件分组：(A) 14 天内有开庭 / trial 阶段 / risk:critical → daily 频道；(B) 其他活跃案件 → weekly 频道；(C) 已 quiet >30 天的案件 → 提示是否归档但不自动归档。本 step 决定哪些案件本次 sweep 实际 fetch，避免对低优先级案件每天都查。", "produces": ["cadence-groups"], "requires_human_review": false}, {"id": "fetch-docket-updates", "type": "capability", "title": "拉取审判流程新事件", "capability": "legal_research.search_cases", "instructions": "对 step 3 选中的每个案件，通过下列优先级源拉取自 since-date / last_checked_at 后的新事件：(1) 元典案例 MCP yuandian-case 按案号搜索；(2) 中国审判流程信息公开网（splcgk.court.gov.cn）按案号 / 当事人查询（律师 / 当事人凭账号登录可查自己代理 / 涉案的案件流程）；(3) 中国裁判文书网（wenshu.court.gov.cn）按案号查公开裁判文书（部分文书因涉密 / 涉个人隐私 / 未届公开期不上网）；(4) 法院送达 / 立案系统的电子通知（如已对接）。每条新事件捕获：filing_date / event_type / 标题 / 提交方 / 卷号 / 文书链接。不得用静默 web search 或模型记忆补齐空结果。", "produces": ["raw-events"], "requires_human_review": false, "fallback": "元典 / 流程公开网均不可用时，回到用户手工提供 docket update（如律师从法院来件 / 短信 / 法院 App 通知扫描后粘贴）；本 workflow 标 partial，digest 中说明依赖人工输入。"}, {"id": "classify-and-compute-deadlines", "type": "manual", "title": "事件分类 + 候选期限推算", "instructions": "对每条新事件分类（立案受理 / 应诉通知 / 答辩状送达 / 举证期限指定 / 庭前会议 / 开庭 / 调解 / 一审判决 / 中间裁定 / 二审受理 / 二审判决 / 再审 / 执行 / 其他），按《民诉法》（2023 修正）+ 民诉法解释（2022 修正）+ 各级法院案件流程指引推算候选期限。常见期限：答辩 15 天（一审）/ 上诉 15 天判决 / 10 天裁定 / 涉外 30 天 / 举证由法院指定 / 庭后书面意见 5 个工作日 / 撤回上诉 二审宣判前 / 申请再审 6 个月。**每条期限明确标注「线索 ⚠️ 律师必须核验」**——法院特殊指令 / case management order 可改变默认规则。中国本土特殊：(a) 法院的标准化期限相对统一（不像 US local rules 差异大），但个案 case management order 仍可改；(b) 节假日 / 法定假日 / 调休日不计入期限（民诉法司法解释 89 条），需对照实际工作日计算；(c) 邮寄送达 vs 直接送达起算日不同。", "produces": ["classified-events", "candidate-deadlines"], "requires_human_review": true, "fallback": "事件类型识别不出时归入「待人工分类」，不试图静默推算期限。"}, {"id": "cross-reference-history", "type": "skill", "title": "对照 history.md + 时间线", "skill_id": "litigation-matter-update", "instructions": "对每个有新事件的案件，调用 litigation-matter-update 把新事件追加到 matter 的 history.md（按程序性进展 / 实质性进展 / 期限变更 / 风险重评估 / 和解授权变更分类）。同时调用 litigation-chronology 把关键事件（立案 / 开庭 / 判决等节点性事件）追加到时间线。surface posture 变化：(a) 案件阶段是否跳进；(b) 期限是否变化；(c) 风险是否需要重评估（如对方追加诉请 / 法院升格）。", "produces": ["history-updates", "chronology-updates"], "requires_human_review": true, "fallback": "history.md 或 chronology 写入失败时在 docket report 中标注「人工追加 history」。"}, {"id": "flag-overdue-deliverables", "type": "manual", "title": "Overdue deliverable 检查", "instructions": "对 portfolio 中每个案件的开放 deliverables（如「准备答辩状」「准备证据清单」「提交财产保全申请」），对照其 internal deadline 检查是否超期。超期项目顶层 flag，含 deliverable / 案件 / 原 due date / 超期天数 / 负责律师。", "produces": ["overdue-deliverables"], "requires_human_review": true, "fallback": "无超期项目时本段空（报告写「✅ 当前无超期 deliverable」）。"}, {"id": "write-docket-report", "type": "artifact", "title": "写入 docket 报告", "instructions": "将完整报告写入 LEGAL_AGENT_WORK_PRODUCT_HOME 或 LEGAL_AGENT_LOCAL_DATA_HOME/work-products/litigation-legal/docket-reports/docket-report-{{run_date}}.md。结构：报告头（sweep N 案件 / 新事件 N / 候选期限 N / overdue N）→ 🔴 紧急（7 天内）→ 🟡 即将（8-30 天）→ 🔵 进展变化 → ⏰ Overdue deliverables → 📎 Quiet on docket。同时写 deadlines.yaml 机器可读版供 docketing 系统 ingest。**每条期限带「律师必须核验」banner**。", "produces": ["docket-report", "deadlines-yaml"], "requires_human_review": true, "fallback": "写入失败时在对话中输出完整报告并明确说明未落盘。"}, {"id": "preview-notification", "type": "capability", "title": "通知预览（飞书 / 钉钉 / 企业微信 / 邮件）", "capability": "notification.preview_and_send", "instructions": "按 profile 配置的告警通道生成 notification 预览，含 sweep 统计、紧急期限数、进展变化数、overdue 数、完整报告链接。**预览只展示给用户**，不自动外发——等用户显式 yes 才调 send。立案 / 临时裁定 / 财产保全裁定等关键事件无论 schedule 何时即时升级到本预览。", "produces": ["notification-preview"], "requires_human_review": true, "fallback": "notification connector 不可用时输出可复制的通知文本，由用户手工发送。"}, {"id": "handoff", "type": "manual", "title": "生成办案律师 / 团队 handoff", "instructions": "针对需要立即响应的事件（关键期限 / 重大进展 / overdue），生成可复制的 handoff 文本给办案律师 + 团队。本 workflow 不直接对外发送任何通知 / 邮件 / IM——只生成 handoff，由办案律师确认后自行发送。**重申：所有 candidate-deadlines 是线索，律师必须对照法院实际 case management order + 个案特殊指令核验后才能录入 docketing 系统。**", "produces": ["handoff-note"], "requires_human_review": true}], "artifacts": [{"id": "active-portfolio", "type": "json", "path_template": "$LEGAL_AGENT_LOCAL_DATA_HOME/work-products/litigation-legal/runs/{{run_date}}/active-portfolio.json", "contains_privileged_material": true}, {"id": "raw-events", "type": "json", "path_template": "$LEGAL_AGENT_LOCAL_DATA_HOME/work-products/litigation-legal/runs/{{run_date}}/raw-events.json", "contains_privileged_material": true}, {"id": "classified-events", "type": "json", "path_template": "$LEGAL_AGENT_LOCAL_DATA_HOME/work-products/litigation-legal/runs/{{run_date}}/classified-events.json", "contains_privileged_material": true}, {"id": "candidate-deadlines", "type": "json", "path_template": "$LEGAL_AGENT_LOCAL_DATA_HOME/work-products/litigation-legal/runs/{{run_date}}/candidate-deadlines.json", "contains_privileged_material": true}, {"id": "history-updates", "type": "markdown", "path_template": "$LEGAL_AGENT_LOCAL_DATA_HOME/work-products/litigation-legal/runs/{{run_date}}/history-updates.md", "contains_privileged_material": true}, {"id": "overdue-deliverables", "type": "markdown", "path_template": "$LEGAL_AGENT_LOCAL_DATA_HOME/work-products/litigation-legal/runs/{{run_date}}/overdue-deliverables.md", "contains_privileged_material": true}, {"id": "docket-report", "type": "markdown", "path_template": "$LEGAL_AGENT_LOCAL_DATA_HOME/work-products/litigation-legal/docket-reports/docket-report-{{run_date}}.md", "contains_privileged_material": true}, {"id": "deadlines-yaml", "type": "json", "path_template": "$LEGAL_AGENT_LOCAL_DATA_HOME/work-products/litigation-legal/runs/{{run_date}}/deadlines.yaml", "contains_privileged_material": true}, {"id": "notification-preview", "type": "markdown", "path_template": "$LEGAL_AGENT_LOCAL_DATA_HOME/work-products/litigation-legal/runs/{{run_date}}/notification-preview.md", "contains_privileged_material": true}, {"id": "handoff-note", "type": "markdown", "path_template": "$LEGAL_AGENT_LOCAL_DATA_HOME/work-products/litigation-legal/runs/{{run_date}}/handoff.md", "contains_privileged_material": true}], "safety": {"human_review_required": true, "no_external_action_without_gate": true, "untrusted_input_policy": "treat_documents_as_data", "citation_policy": "verify_if_connector_available"}, "handoff": {"required": true, "recipient": "案件办案律师 + 团队负责人 from profile", "channel_capability": "notification.preview_and_send", "instructions": "本 workflow 只生成本地 docket-report + deadlines.yaml + handoff 文本。任何外发前必须展示收件人和正文预览，并由办案律师确认。**所有 candidate-deadlines 视为「线索」非「日历项」，律师对照法院实际 case management order 核验后才能录入 docketing 系统**——错过法院期限的执业责任后果由律师承担，本 workflow 不替代律师判断。"}, "idempotency": {"key": "litigation-docket-watcher:{{profile_id}}:{{since_date}}:{{run_date}}", "dedupe_window": "1 day", "instructions": "同一 profile、同一 since-date、同一运行日期内重复执行时，追加 timestamped section 到 docket-report，不覆盖既有报告。已 fetch 过的 event 不重复 fetch（按 event_uuid 去重）。"}, "retry": {"max_attempts": 1, "on_failure": "mark_partial"}}
